Original Comment,Cleaned Comment,Label,Hate,Disinfo,Normal,Hate Words
තාත්තාලා පුතාලා  රටේ සල්ලි ගසා  කාලා ජනතාව පාරට  දාලා රට විනාස කරලා තියෙන තරමට අවුරුදු 27කින්වත් රටේ  ආදායම  ගොඩ ගන්න බැරි බව නාමලයා ම තමයි  හොදට දන්නෙ.උන්ම නෙ දන්නෙ කාපු  කෑම.,තාත්තාලා පුතාලා රටේ සල්ලි ගසා කාලා ජනතාව පාරට දාලා රට විනාස කරලා තියෙන තරමට අවුරුදු 27කින්වත් රටේ ආදායම ගොඩ ගන්න බැරි බව නාමලයා ම තමයි හොදට දන්නෙඋන්ම නෙ දන්නෙ කාපු කෑම,DISINFO,0,1,0,
උඹලා හොරා කාපු සල්ලි දීපිය රටට.එතකොට හරි,උඹලා හොරා කාපු සල්ලි දීපිය රටටඑතකොට හරි,HATE,1,0,0,
ජය වේවා ජනාධිපතිතුමනි❤🙏,ජය වේවා ජනාධිපතිතුමනි,NORMAL,0,0,1,
Uba ammamaga rada anura😂kura kara ballo thopienie aragalla karalla balla😂😂😂😂🔫,Uba ammamaga rada anurakura kara ballo thopienie aragalla karalla balla,HATE,1,0,0,"ballo, balla"
​ඩෝබිල​ගේ ක​මෙන්ට් ම විතරක් දැක්කා,ඩෝබිලගේ කමෙන්ට් ම විතරක් දැක්කා,HATE,1,0,0,
පාර්ලිමේන්තුවෙ බොරැ කියනවා එලියෙ කියන්නෙ නැහැ කීමටපමණයි එලියෙත් බොරැකියනවා,පාර්ලිමේන්තුවෙ බොරැ කියනවා එලියෙ කියන්නෙ නැහැ කීමටපමණයි එලියෙත් බොරැකියනවා,NORMAL,0,0,1,
වචනයේ අර්තයෙන්ම රටට ආදරේ මිනිසෙක්,වචනයේ අර්තයෙන්ම රටට ආදරේ මිනිසෙක්,NORMAL,0,0,1,
ඕකුන් ඵන්නෑ කුහක හැත්ත දැන් අනාත වෙලා ඉන්නේ හොරාකන්න කොමිස් ගන්න නෑනේ,ඕකුන් ඵන්නෑ කුහක හැත්ත දැන් අනාත වෙලා ඉන්නේ හොරාකන්න කොමිස් ගන්න නෑනේ,HATE,1,0,0,කුහක
මූ ඉල්ගෙන හූ වෙන්නේ නෑමොලේට කට උත්තර නෑ 😂😂😂,මූ ඉල්ගෙන හූ වෙන්නේ නෑමොලේට කට උත්තර නෑ,HATE,1,0,0,නෑ
නාකී මයිනා රට සුද්ද කලානේ ඔබට ඒවා අමතක ද නෑමොලයෝ ඔබ දීපන් හොරා කාපු සල්ලි,නාකී මයිනා රට සුද්ද කලානේ ඔබට ඒවා අමතක ද නෑමොලයෝ ඔබ දීපන් හොරා කාපු සල්ලි,NORMAL,0,0,1,
Namalaya hithagena inne hinen janadi pathi wenne jobekak nokara hora kala pimpiyek,Namalaya hithagena inne hinen janadi pathi wenne jobekak nokara hora kala pimpiyek,NORMAL,0,0,1,
"නාමල් ඔයාගේ දැනුම මදි .
අපේ ජනපතිගෙන් ඔලුව කුඩුකරගන්ට වෙන්නේ .",නාමල් ඔයාගේ දැනුම මදි අපේ ජනපතිගෙන් ඔලුව කුඩුකරගන්ට වෙන්නේ,NORMAL,0,0,1,
Anura sahodaraya .mu mekkkek oyata .mona wesa ballaekda  mu .kalamanni wesaballla  tota hnagahanawa wesa balla.mn prsidant unanam wesa balla namal tota ula tiyanawa gotaya.kala kqnniya,Anura sahodaraya mu mekkkek oyata mona wesa ballaekda mu kalamanni wesaballla tota hnagahanawa wesa ballamn prsidant unanam wesa balla namal tota ula tiyanawa gotayakala kqnniya,HATE,1,0,0,balla
ුඅනේ.වැඩබැරි.ආණ්ඩුවක්.බොරැකියන.ජානාධිපති..පරණපොත්.පචිචුවෙි.ඔයජනාධිපතිලා,ුඅනේවැඩබැරිආණ්ඩුවක්බොරැකියනජානාධිපතිපරණපොත්පචිචුවෙිඔයජනාධිපතිලා,HATE,1,0,0,
Owa kiwata oka dannath na kiwata tharannath na .,Owa kiwata oka dannath na kiwata tharannath na,NORMAL,0,0,1,
"thopi.wage.horu.innakota.kohomada.pako.rata.
diunuwenne",thopiwagehoruinnakotakohomadapakorata diunuwenne,HATE,1,0,0,
Anura den Maru kiyawanawa idiriye srsgala eddi duwanna dennene topiya denawa balana inna,Anura den Maru kiyawanawa idiriye srsgala eddi duwanna dennene topiya denawa balana inna,NORMAL,0,0,1,
❤❤❤❤❤Akd........🎉,Akd,NORMAL,0,0,1,
Ditta suli kunatuwan takaramak giyath laksa 1000000 danawa kiuwa wagada anura kumara mahaththayo arthikaya wardanaya wanne,Ditta suli kunatuwan takaramak giyath laksa 1000000 danawa kiuwa wagada anura kumara mahaththayo arthikaya wardanaya wanne,DISINFO,0,1,0,
Namal thopi me rata vinashama kara.lajja nathiwa thawath katha karanawa kudu karaya.thope paulata hena gahanawa.,Namal thopi me rata vinashama karalajja nathiwa thawath katha karanawa kudu karayathope paulata hena gahanawa,HATE,1,0,0,
සක්කිලි රාජපක්ෂ ල එළියේ තියා ගෙන කුප්ප කතා අහනවා,සක්කිලි රාජපක්ෂ ල එළියේ තියා ගෙන කුප්ප කතා අහනවා,HATE,1,0,0,සක්කිලි
Namolaya gona,Namolaya gona,HATE,1,0,0,gona
Horak adanawa,Horak adanawa,NORMAL,0,0,1,
Namal mahaththya oya boruwa ke Gahanna apa oya kiyana dewal minissu piliganne neee😅😅😅,Namal mahaththya oya boruwa ke Gahanna apa oya kiyana dewal minissu piliganne neee,HATE,1,0,0,minissu
සාටක පරම්පරාව නම් අවුරුදු 65කට නෙවෙයි අවුරුදු සීයකටම පාලනය කරපු කාලයේ ධනය හොයා ගත්ත. රට බංකොල්ලොත් කරලා ඉවරවෙලා තවත් රට පාලනය කරන්න බලේ ඉල්ලනවා.,සාටක පරම්පරාව නම් අවුරුදු 65කට නෙවෙයි අවුරුදු සීයකටම පාලනය කරපු කාලයේ ධනය හොයා ගත්ත රට බංකොල්ලොත් කරලා ඉවරවෙලා තවත් රට පාලනය කරන්න බලේ ඉල්ලනවා,DISINFO,0,1,0,
Any buruwa namal bLa,Any buruwa namal bLa,HATE,1,0,0,buruwa
"මේ කථාව අහගන්න
හොඳට ඉගෙනගන්න
නාමල් මහත්මයා
👀👀👀👀👀👀👀👀",මේ කථාව අහගන්න හොඳට ඉගෙනගන්න නාමල් මහත්මයා,NORMAL,0,0,1,
ලස්සන හීනෙක ඉන්න නාමල් ..🫢,ලස්සන හීනෙක ඉන්න නාමල්,NORMAL,0,0,1,
Namolayata janadipathii sihinayen Maru kiyawanawa.mahajanathawa munta Aya rawatennai na.,Namolayata janadipathii sihinayen Maru kiyawanawamahajanathawa munta Aya rawatennai na,NORMAL,0,0,1,
මේකනම් මහ මීී හරකෙක් තොපේ තාත්තලා බාප්පලා කරපුවා තමයි යකෝ මේ ගෙවන්නේ මුගෙ දත් දෙක කඩන්න විදියක් නෑනේ,මේකනම් මහ මීී හරකෙක් තොපේ තාත්තලා බාප්පලා කරපුවා තමයි යකෝ මේ ගෙවන්නේ මුගෙ දත් දෙක කඩන්න විදියක් නෑනේ,HATE,1,0,0,දත්
අම්මෝ නාමල්ටනම් තනිකරම පිස්සු හැදිල ඉන්නෙ .,අම්මෝ නාමල්ටනම් තනිකරම පිස්සු හැදිල ඉන්නෙ,HATE,1,0,0,
Niyamai AKD❤🔥,Niyamai AKD,NORMAL,0,0,1,
Yako.tho.dan.ratahadanna.thogan.danuma.ganna.onada.thota.hambaway.balagana.hitapiya.,Yakothodanratahadannathogandanumagannaonadathotahambawaybalaganahitapiya,HATE,1,0,0,
නාමල කතා කරන්නේ මැරිලා උපදිලා වගේ කාලකන්නියස්,නාමල කතා කරන්නේ මැරිලා උපදිලා වගේ කාලකන්නියස්,HATE,1,0,0,වගේ
ඔබට  රට දෙන්නේ කවුද කවුරුහරි  ලියලා දුන් දෙයක් කට පාඩමෙන් කියවනවා  මෝඩ හරකෙක්  දන්න දෙයක් නෑ ඔබලා ගේ පරමි පරවට තිබුනේ වහල් කම විතරයි,ඔබට රට දෙන්නේ කවුද කවුරුහරි ලියලා දුන් දෙයක් කට පාඩමෙන් කියවනවා මෝඩ හරකෙක් දන්න දෙයක් නෑ ඔබලා ගේ පරමි පරවට තිබුනේ වහල් කම විතරයි,NORMAL,0,0,1,
Ane wadinnam me rata Dan hodata yanava .Aya nam Enna epa thope ekek wath,Ane wadinnam me rata Dan hodata yanava Aya nam Enna epa thope ekek wath,NORMAL,0,0,1,
Namal tho ayeth ennada hadanne rata winasa karanna,Namal tho ayeth ennada hadanne rata winasa karanna,HATE,1,0,0,karanna
"2.5 National Lister, Namal Rajapaksa.  Talk some thing worth.  Don't try to sabotage.  
Remember, NPP Government is elected by majority of us.  
Stop barking mad!",25 National Lister Namal Rajapaksa Talk some thing worth Dont try to sabotage Remember NPP Government is elected by majority of us Stop barking mad,NORMAL,0,0,1,
Thopie horakam jarapu hinda thaime srivlankawata ohamaxunay thopita no vote,Thopie horakam jarapu hinda thaime srivlankawata ohamaxunay thopita no vote,NORMAL,0,0,1,
Ow ow thota thamai diyunu karanna puluwan.thoge thaththai thoge bappai 20years with Ara me karala thiyenne.ekane mechchara Naya une rata. Minissu pahalata wetune  mechchara.thopi hora kala kala.pana pitin thopi yamapallo edan yanakan API balan enne.thope lamain tath hena gahanawa.balaw.hora kapu ewa Dan wath deepiyawu.para haththa.ammo  namola yage parinatha kama.hal l  pol l gathama w ena mukuth karanna b,Ow ow thota thamai diyunu karanna puluwanthoge thaththai thoge bappai 20years with Ara me karala thiyenneekane mechchara Naya une rata Minissu pahalata wetune mechcharathopi hora kala kalapana pitin thopi yamapallo edan yanakan API balan ennethope lamain tath hena gahanawabalawhora kapu ewa Dan wath deepiyawupara haththaammo namola yage parinatha kamahal l pol l gathama w ena mukuth karanna b,DISINFO,0,1,0,
Fackar you are mother fuckar namole,Fackar you are mother fuckar namole,NORMAL,0,0,1,
",, රාජපක්ෂ පවුල රට කාලා දැන් එනවද රට හදන්න",රාජපක්ෂ පවුල රට කාලා දැන් එනවද රට හදන්න,NORMAL,0,0,1,
Ane moda pakayo tho katha karana kota apita thoge buru kama penawa .,Ane moda pakayo tho katha karana kota apita thoge buru kama penawa,HATE,1,0,0,"moda, pakayo, buru, kama"
Minimaru.  Anura.  Paraballa. Katawahapiya. Musalaya. Kupadita. 88. 89.  Minimaruwa,Minimaru Anura Paraballa Katawahapiya Musalaya Kupadita 88 89 Minimaruwa,HATE,1,0,0,"Paraballa, Musalaya, Kupadita"
Ganichche thaththala puthala,Ganichche thaththala puthala,NORMAL,0,0,1,
"අනේහොර..කාඩබල්ලෝ..තොපේ...පාහර..බල්ලොමේරටම...සුංකරල..දැන්..නෑමොලේ...ගොංඅලිය..මේරට..විනාස..කරපුහොර..හැත්ත..එනව..අතිගරු..ජනාධිපති .......උතුමාට..රටකනහැටි..කියන්නගොංනාම්බෝ...උබලගෙහොරකන්ඩායම..මේරටම...හොරාකාලතෝද..ඉන්..එකහොරෙක්..ඒකාලෙ...උබලගෙකෙරුම්..උබලටදැන්.......අමතකවෙලා.
වගේ...අනේහුත්තෝ",අනේහොරකාඩබල්ලෝතොපේපාහරබල්ලොමේරටමසුංකරලදැන්නෑමොලේගොංඅලියමේරටවිනාසකරපුහොරහැත්තඑනවඅතිගරුජනාධිපති උතුමාටරටකනහැටිකියන්නගොංනාම්බෝඋබලගෙහොරකන්ඩායමමේරටමහොරාකාලතෝදඉන්එකහොරෙක්ඒකාලෙඋබලගෙකෙරුම්උබලටදැන්අමතකවෙලා වගේඅනේහුත්තෝ,DISINFO,0,1,0,
උඹලගේ ආන්ඩුව තියෙද්දි ග රැඩිකල් තින්දු ගත්තනම් ලන්කාව සින්ගප්පුරුවක් කරන්න තිබ්බා. ප.........යා.,උඹලගේ ආන්ඩුව තියෙද්දි ග රැඩිකල් තින්දු ගත්තනම් ලන්කාව සින්ගප්පුරුවක් කරන්න තිබ්බා පයා,NORMAL,0,0,1,
"Anura  Sahodaraya that chap only shouting trying  to  show that he 
Knows  about politics because his father and  his family stole SL  public wealth. That’s  the only qualification he has.
He has not earn any money  except
Via back door  ( not from public)
came to parliament.
He should go back to nursery and lead to decent life.",Anura Sahodaraya that chap only shouting trying to show that he Knows about politics because his father and his family stole SL public wealth Thats the only qualification he has He has not earn any money except Via back door not from public came to parliament He should go back to nursery and lead to decent life,DISINFO,0,1,0,
"Namo..ubata.kiyana.dayak.na....ubala.kawa
Rata....bapa..potaya.basil.kaputa..kakulwa.wahpnkata..thohagay.rada..",Namoubatakiyanadayaknaubalakawa Ratabapapotayabasilkaputakakulwawahpnkatathohagayrada,HATE,1,0,0,
menna janadi petelaa,menna janadi petelaa,NORMAL,0,0,1,
"රට විනාශම කරලා කරලා දැන් කතාකරන හැටි, ලැජ්ජයි නාමල්, ලැජ්ජයි.",රට විනාශම කරලා කරලා දැන් කතාකරන හැටි ලැජ්ජයි නාමල් ලැජ්ජයි,NORMAL,0,0,1,
ජනාධිපති තුමාට  බුදුසරණ ❤,ජනාධිපති තුමාට බුදුසරණ,NORMAL,0,0,1,
Ane namel oyita kalin hitnnna tibunne,Ane namel oyita kalin hitnnna tibunne,HATE,1,0,0,
මූට මොන්ගල්ද කවුද උබලට රට දෙන්නේ,මූට මොන්ගල්ද කවුද උබලට රට දෙන්නේ,HATE,1,0,0,
ඩෝබිලඩ බෝනස් වගේ,ඩෝබිලඩ බෝනස් වගේ,HATE,1,0,0,වගේ
හිරු එකේ වැඩ්ඩෝ තමා නාමලයා. නොදකින් මූසlaya,හිරු එකේ වැඩ්ඩෝ තමා නාමලයා නොදකින් මූසlaya,HATE,1,0,0,
ජනපති අප ඔබ සමගයි.,ජනපති අප ඔබ සමගයි,NORMAL,0,0,1,
Thota balayanam denne hora padanguwa,Thota balayanam denne hora padanguwa,HATE,1,0,0,"denne, hora, padanguwa"
"Namole you waste Government precious time.
Namole you did not enter parliament by  SL  public instead opposition MP s",Namole you waste Government precious time Namole you did not enter parliament by SL public instead opposition MP s,DISINFO,0,1,0,
මුන්  මරන්න  ඕනෑ හිටුවා පස් ගහලා  .පට්‍ට පල් නීල කාස කම්බ හොරු තුක් නොදකින් කාලකණ්ණි තිරිසන් පව්කාර හැත්ත රට ජාතීය වළපල්ලට ඇදලා දාපූ පරපෝෂිතයෝ තුක් නොදකින් .,මුන් මරන්න ඕනෑ හිටුවා පස් ගහලා පට්ට පල් නීල කාස කම්බ හොරු තුක් නොදකින් කාලකණ්ණි තිරිසන් පව්කාර හැත්ත රට ජාතීය වළපල්ලට ඇදලා දාපූ පරපෝෂිතයෝ තුක් නොදකින්,HATE,1,0,0,"මරන්න, ඕනෑ, ගහලා, කාලකණ්ණි, තිරිසන්, පරපෝෂිතයෝ"
අසික්කිත විදිහට බදු ගහලා වියාපාර ගොඩ ගන්න බැ මෙවර බදු මුදල් ලොකුවට ලැබිලා ඇති.. මිනිස්සු වියාපාර අතහැරලා දැම්මම.. උඩ බලන් ඉන්න wei.. බදු අය කිරීම ක්‍රමනු කුලව කරන්න..,අසික්කිත විදිහට බදු ගහලා වියාපාර ගොඩ ගන්න බැ මෙවර බදු මුදල් ලොකුවට ලැබිලා ඇති මිනිස්සු වියාපාර අතහැරලා දැම්මම උඩ බලන් ඉන්න wei බදු අය කිරීම ක්රමනු කුලව කරන්න,DISINFO,0,1,0,
A..k..d❤❤❤❤❤❤❤❤,Akd,NORMAL,0,0,1,
"Namal harima hondata paule
Paramparwema 
Ugath kama hondata helidarau 
Karanawa

Munge paulama
Pasalakata wahi
Welawakataeath
Giya Nathi baw
Pennawa",Namal harima hondata paule Paramparwema Ugath kama hondata helidarau Karanawa Munge paulama Pasalakata wahi Welawakataeath Giya Nathi baw Pennawa,HATE,1,0,0,kama
Chandrika medam karanna  ona de kala kiyanna ona de kiwa.,Chandrika medam karanna ona de kala kiyanna ona de kiwa,NORMAL,0,0,1,
"Me balla hariyata katha karanne anduwa aurudu 10 ,20 k giya wage.mu harak kstha kiyala monawada balapiroththu wenne.",Me balla hariyata katha karanne anduwa aurudu 10 20 k giya wagemu harak kstha kiyala monawada balapiroththu wenne,HATE,1,0,0,"balla, harak"
Kuda ban arthika gathakaya une usaviyedi.,Kuda ban arthika gathakaya une usaviyedi,HATE,1,0,0,
"ඒ ක  ඒ කාලේ.
තවම 2026 .
2030 ට තව කල් තියනවා. හදිස්සි නැතිව යමු හොඳේ.
හාවාගෙයි ඉබ්බාගෙ යි කතාව දන්නවද ඇතිනේ.",ඒ ක ඒ කාලේ තවම 2026 2030 ට තව කල් තියනවා හදිස්සි නැතිව යමු හොඳේ හාවාගෙයි ඉබ්බාගෙ යි කතාව දන්නවද ඇතිනේ,NORMAL,0,0,1,
පල හොර අප්පච්චි කෙලිය රටට අපේ සල්ලි සේරම විනස කලා රට ගින්නෙක් කරලා දමලා උන්ගේ බැ න්කු පොරෝගෙන සල්ලි මුතු මැ නික් රත්තරන් ඒක මිසෙකු ට මොනාද තොපි කාලේ දැන් එනවා බයි ලා කියන්න,පල හොර අප්පච්චි කෙලිය රටට අපේ සල්ලි සේරම විනස කලා රට ගින්නෙක් කරලා දමලා උන්ගේ බැ න්කු පොරෝගෙන සල්ලි මුතු මැ නික් රත්තරන් ඒක මිසෙකු ට මොනාද තොපි කාලේ දැන් එනවා බයි ලා කියන්න,DISINFO,0,1,0,
Namal gotayo ube oi bana gadar gihin kiyaganin balla,Namal gotayo ube oi bana gadar gihin kiyaganin balla,HATE,1,0,0,"ube, balla"
උබලා තමයි රටට ඩොලර් එවන්න ඇපා කියලා කව්වේ 22අන්ඩුවේ කාලයේ උබලා තමයි අර්ථිකය බිංදුවට වට්ටන්න වැඩ  වර්ජනය කරන්න රටේ විනාසකරපු කාලකන්නි වාහාල්ලු ජෙප්පපෝ,උබලා තමයි රටට ඩොලර් එවන්න ඇපා කියලා කව්වේ 22අන්ඩුවේ කාලයේ උබලා තමයි අර්ථිකය බිංදුවට වට්ටන්න වැඩ වර්ජනය කරන්න රටේ විනාසකරපු කාලකන්නි වාහාල්ලු ජෙප්පපෝ,DISINFO,0,1,0,
ගූ ජෙපි කාලකන්නි සල්ලි එවන්න එපා කියපු හැත්ත,ගූ ජෙපි කාලකන්නි සල්ලි එවන්න එපා කියපු හැත්ත,HATE,1,0,0,"ගූ, කාලකන්නි"
Tope paramparawama rata kala tope naya epita una pol buruwa gon namal.,Tope paramparawama rata kala tope naya epita una pol buruwa gon namal,HATE,1,0,0,"pol, buruwa, gon"
Thopi rate mudal horakala dan pacha kelinawa febarawari 16 kris naduwa miliyana 70 redderewila  inne gothayage,Thopi rate mudal horakala dan pacha kelinawa febarawari 16 kris naduwa miliyana 70 redderewila inne gothayage,DISINFO,0,1,0,
ubala hora kapu hetiyata ethi ohomawath tiyenawa,ubala hora kapu hetiyata ethi ohomawath tiyenawa,NORMAL,0,0,1,
මුන් කතා කරන්නෙ උන්ගෙ ආන්ඩූවෙන් පොසොන රටක් කලා වගෙ ඔය බොරු කියන කට කපන්න ඕන තුනට හතරට ඔය කටෙ පනුවො ගහල තමයි මැරෙන්නෙ පල් හොරු ටික දැන් එනව රට හදන්න   බොරු කිය කිය මිනිස්සුන්ගෙ ඔලුවට විෂබිජ දාන්නැතිව පාඩූවෙ ඉදපන් නෑමල් ජනාධිපතිතූමා විවසිමෙන් තාමත් වැඩ කරන්නෙ රට හොරා කාල කාල දැන් ජනාධිපතිතුමා යන්තන් ගොඩගන්න උත්සහ ගන්නකොට මුන්ට එව දරාගන්න බෑ කියන රගෙ බලපල්ලකො ඔහොම යන් මම එහෙම නමි මුගෙ කට කපනව රගන රැගිල්ලට මුන් ලංකාවට ආදරෙ නැත්තෙ මුන් රොඩ් එකයි ජනාධිපතිතුමාට ජයවෙවා,මුන් කතා කරන්නෙ උන්ගෙ ආන්ඩූවෙන් පොසොන රටක් කලා වගෙ ඔය බොරු කියන කට කපන්න ඕන තුනට හතරට ඔය කටෙ පනුවො ගහල තමයි මැරෙන්නෙ පල් හොරු ටික දැන් එනව රට හදන්න බොරු කිය කිය මිනිස්සුන්ගෙ ඔලුවට විෂබිජ දාන්නැතිව පාඩූවෙ ඉදපන් නෑමල් ජනාධිපතිතූමා විවසිමෙන් තාමත් වැඩ කරන්නෙ රට හොරා කාල කාල දැන් ජනාධිපතිතුමා යන්තන් ගොඩගන්න උත්සහ ගන්නකොට මුන්ට එව දරාගන්න බෑ කියන රගෙ බලපල්ලකො ඔහොම යන් මම එහෙම නමි මුගෙ කට කපනව රගන රැගිල්ලට මුන් ලංකාවට ආදරෙ නැත්තෙ මුන් රොඩ් එකයි ජනාධිපතිතුමාට ජයවෙවා,DISINFO,0,1,0,
Baby oyata ba kawadawath janapathi wenna patta hora,Baby oyata ba kawadawath janapathi wenna patta hora,NORMAL,0,0,1,
අනේ නිකන් පලයන් පච කොටා යන්න,අනේ නිකන් පලයන් පච කොටා යන්න,NORMAL,0,0,1,
මේ රජය හොඳ වැඩියී... නැතිනම් මේවගේ හොරු මෙච්චර දොඩවන්නේ නැ... දැන ගස්සන්නම් කියපු රජයක් මේක... ඒ දේ කරලා නැ අද වෙනකන්,මේ රජය හොඳ වැඩියී නැතිනම් මේවගේ හොරු මෙච්චර දොඩවන්නේ නැ දැන ගස්සන්නම් කියපු රජයක් මේක ඒ දේ කරලා නැ අද වෙනකන්,NORMAL,0,0,1,
Ubala...radical...karana.......pala...buru...puta....namal....mara...kiyawanwa....boruwata...kghanawa....pisso.....atpolasan..danawa......a..k...d...❤❤❤❤❤❤jayawawa❤❤❤❤❤,Ubalaradicalkaranapalaburuputanamalmarakiyawanwaboruwatakghanawapissoatpolasandanawaakdjayawawa,HATE,1,0,0,
මේ කාලකන්නි මූසල නාමලයා.,මේ කාලකන්නි මූසල නාමලයා,HATE,1,0,0,"කාලකන්නි, මූසල"
