Original Comment,Cleaned Comment,Label,Hate,Disinfo,Normal,Hate Words
Pinata evith dodawanwa  pissu,Pinata evith dodawanwa pissu,HATE,1,0,0,"dodawanwa, pissu"
මේ තොරිසන් නාමලය ජාතික ලැයිස්තුවේන් ඇවිත් මුගේ ලොකු ටොක් බ්ලපල්ලකො මුට ගහලා එලවන්න ඔතන කවුරුත්  නැහැනේ,මේ තොරිසන් නාමලය ජාතික ලැයිස්තුවේන් ඇවිත් මුගේ ලොකු ටොක් බ්ලපල්ලකො මුට ගහලා එලවන්න ඔතන කවුරුත් නැහැනේ,NORMAL,0,0,1,
සාටකයා මරැ කියවනව. උන් ආණ්ඩුව කලා නම් උන්.දියුණු වෙයි අපිට දුක්විදින්න  වෙයි තියෙන මියෙනා තුරැ..,සාටකයා මරැ කියවනව උන් ආණ්ඩුව කලා නම් උන්දියුණු වෙයි අපිට දුක්විදින්න වෙයි තියෙන මියෙනා තුරැ,NORMAL,0,0,1,
ඇ බන් උබලා පොල් ගැවද උබලා බලේ හිටිය නේද එතකොට මොලේ තිබ්බේ හොරා කන්න විතරද,ඇ බන් උබලා පොල් ගැවද උබලා බලේ හිටිය නේද එතකොට මොලේ තිබ්බේ හොරා කන්න විතරද,HATE,1,0,0,මොලේ
Good Anurakumara,Good Anurakumara,NORMAL,0,0,1,
"වචනයක් කයනවනම් එය ඔප්පු කරන්ඩ  පුළුවන් වියයුතුයි,රට දාලගිය එක ආයෝජකයකුගැන  නාමල්ට කියන්ඩ බැරිවුනානෙ,ජනාධිපති එක්ක බොරු කතා කියල නාමල්ට බේරෙන්ඩ බෑ.",වචනයක් කයනවනම් එය ඔප්පු කරන්ඩ පුළුවන් වියයුතුයිරට දාලගිය එක ආයෝජකයකුගැන නාමල්ට කියන්ඩ බැරිවුනානෙජනාධිපති එක්ක බොරු කතා කියල නාමල්ට බේරෙන්ඩ බෑ,NORMAL,0,0,1,
Namal heluwen..😅😅😅😅😅,Namal heluwen,HATE,1,0,0,heluwen
maka pissak namalya,maka pissak namalya,HATE,1,0,0,pissak
ඔය සාටකයා කනෙන් අල්ලලා එලියට දාන්න ජනාධිපතිතුමනි 😅,ඔය සාටකයා කනෙන් අල්ලලා එලියට දාන්න ජනාධිපතිතුමනි,HATE,1,0,0,"කනෙන්, අල්ලලා, එලියට, දාන්න"
අනුර. මහත්තය ඕවට උත්තර උවමනා නෑ. රට කරගෙක යන්ඩ.,අනුර මහත්තය ඕවට උත්තර උවමනා නෑ රට කරගෙක යන්ඩ,NORMAL,0,0,1,
චන්දෙන් දිනල පාඒලිමේන්තුවට ආවනං,චන්දෙන් දිනල පාඒලිමේන්තුවට ආවනං,NORMAL,0,0,1,
Jathika laistuwen awa muge pada show.reddai rewenawa namolai,Jathika laistuwen awa muge pada showreddai rewenawa namolai,NORMAL,0,0,1,
නාමල් ඔය සාටකයේ බෙල්ලෙ වැල දාගනින්,නාමල් ඔය සාටකයේ බෙල්ලෙ වැල දාගනින්,HATE,1,0,0,"බෙල්ලෙ, වැල, දාගනින්"
රටේ සල්ලි හොරා කාපු නෑ මොළය අධෝමුබයෙන් කතාකරයි,රටේ සල්ලි හොරා කාපු නෑ මොළය අධෝමුබයෙන් කතාකරයි,HATE,1,0,0,නෑ
"මේ ගොන් කොල්ලට කවුද මේ කියලා දෙන්නේ,",මේ ගොන් කොල්ලට කවුද මේ කියලා දෙන්නේ,NORMAL,0,0,1,
Niyamai janadipathi thuma❤,Niyamai janadipathi thuma,NORMAL,0,0,1,
A kariyo thopea anduwala  ratea diunuwata  wadak kalada kariyo  thopita  andu  karanna  labennea nea,A kariyo thopea anduwala ratea diunuwata wadak kalada kariyo thopita andu karanna labennea nea,HATE,1,0,0,"kariyo, wadak, karanna"
නෑ මොලය කථා නැහැ මූ ලිස්ට් එකෙන් ඇවිත් මාර සෝබන පෙන්වනවා.  මොන්ගල් නෑ මොලයා,නෑ මොලය කථා නැහැ මූ ලිස්ට් එකෙන් ඇවිත් මාර සෝබන පෙන්වනවා මොන්ගල් නෑ මොලයා,HATE,1,0,0,"නෑ, නැහැ, මොන්ගල්"
පොඩි මයිනා මරු කියවනවා මෙක කලා කලා පව් ඔයි.,පොඩි මයිනා මරු කියවනවා මෙක කලා කලා පව් ඔයි,NORMAL,0,0,1,
යකෝ ජන්දේ ඉල්ලල වරෙන් කතාකරන්න මු අමු ගවයේක්,යකෝ ජන්දේ ඉල්ලල වරෙන් කතාකරන්න මු අමු ගවයේක්,HATE,1,0,0,අමු
තබුත්තේගම.රංබන්ඩා.ජාතක.කරපු.පුතා.රටට.කෙලපු.ත්‍රස්තවාදියෙක්..මොනව.කිව්වත්.පසුබිමක්.තියෙන්න.ඕනෑ.,තබුත්තේගමරංබන්ඩාජාතකකරපුපුතාරටටකෙලපුත්රස්තවාදියෙක්මොනවකිව්වත්පසුබිමක්තියෙන්නඕනෑ,HATE,1,0,0,
මව පාර්ලිමෙන්කුවට යවපල්ලා හනිවා මහිදගේ කැරි කොල්ලට මුහුණ කුඩුවෙන්න හපතයා හොරා නාමල් වේස පක්ෂ  පර බල්ලා,මව පාර්ලිමෙන්කුවට යවපල්ලා හනිවා මහිදගේ කැරි කොල්ලට මුහුණ කුඩුවෙන්න හපතයා හොරා නාමල් වේස පක්ෂ පර බල්ලා,HATE,1,0,0,"කැරි, පර, බල්ලා"
නාමල් උබ දකින කොට අපිට නිකරුනේ පවු පිරෙනව බං,නාමල් උබ දකින කොට අපිට නිකරුනේ පවු පිරෙනව බං,NORMAL,0,0,1,
තොපි,තොපි,HATE,1,0,0,තොපි
නාමල්යා ගෙ 👄 කට  නාමලයෝ අම්මා ගේ රෙද්ද  කටින් ද කියන්නේ  පුකෙන්ද මගේ ඇගේ මාලු නටනවා ජනාධිපති තුමා ව සෙල්ලමට අරගෙන  පිස්සෙක් යකෝ මුන් රට පාලනය කෙරුවේ  කොහොමද දන්නෙ නැහැ  😢😢😢😢😢😢 බල්ලටත් රත්තරන් දාපු රාජපක්ෂ  පව්ල  🐄🐄🐄🐄🐄🐄🐄,නාමල්යා ගෙ කට නාමලයෝ අම්මා ගේ රෙද්ද කටින් ද කියන්නේ පුකෙන්ද මගේ ඇගේ මාලු නටනවා ජනාධිපති තුමා ව සෙල්ලමට අරගෙන පිස්සෙක් යකෝ මුන් රට පාලනය කෙරුවේ කොහොමද දන්නෙ නැහැ බල්ලටත් රත්තරන් දාපු රාජපක්ෂ පව්ල,DISINFO,0,1,0,
හොරකම් කරපුවා ගේන්න බැරිද නාමල්😂,හොරකම් කරපුවා ගේන්න බැරිද නාමල්,NORMAL,0,0,1,
"ඔයනැමොලයාට රගන්න නොදි උස්සල
හිරෙදාන්න එතනින් කෙලවර නොකර මරණදඩුවම දෙන්න රාජපක්ෂ නඩේටම මුන්රටකැවා උන්ගේ  පවුල් නඉත්තුවුනා ජනතාව පාරට බැස්සුවා කුඩු ගෙන්නලා ව්‍යපාර කරලා නැටුවා අපේ මේ මැනිකක්වැනි ජනාදිපති ආයින් අපේරට බේරැනා දැන් නැමොලයෝ පචකෙල කෙල මඩගහන්නේ නැතුව හිරෙයනතුරැ හිටු ☝🥸",ඔයනැමොලයාට රගන්න නොදි උස්සල හිරෙදාන්න එතනින් කෙලවර නොකර මරණදඩුවම දෙන්න රාජපක්ෂ නඩේටම මුන්රටකැවා උන්ගේ පවුල් නඉත්තුවුනා ජනතාව පාරට බැස්සුවා කුඩු ගෙන්නලා ව්යපාර කරලා නැටුවා අපේ මේ මැනිකක්වැනි ජනාදිපති ආයින් අපේරට බේරැනා දැන් නැමොලයෝ පචකෙල කෙල මඩගහන්නේ නැතුව හිරෙයනතුරැ හිටු,DISINFO,0,1,0,
"Naya."" Cobr."" Kiyala pennanna janadipati tumani",Naya Cobr Kiyala pennanna janadipati tumani,NORMAL,0,0,1,
Tathalabapala.thopekale.thama.ajakayo.dalagiye.pagamaruvo.,Tathalabapalathopekalethamaajakayodalagiyepagamaruvo,HATE,1,0,0,
නැමොලයො තො මොනවද කියන්නෙ තොත් රටකරානෙද මු ලිසටි ළුකෙන් ඇවිත් හරියට මැරිලා ඉපදිලා වගෙ කතාව,නැමොලයො තො මොනවද කියන්නෙ තොත් රටකරානෙද මු ලිසටි ළුකෙන් ඇවිත් හරියට මැරිලා ඉපදිලා වගෙ කතාව,HATE,1,0,0,කියන්නෙ
"උගෙ ආන්ඩුව 😂😂😂😂
චන්දෙන් පාර්ලිමේන්තුවට එන්න බැරිව පිනට ආපු නාමල් 😂😂😂😂😂",උගෙ ආන්ඩුව චන්දෙන් පාර්ලිමේන්තුවට එන්න බැරිව පිනට ආපු නාමල්,NORMAL,0,0,1,
Namoleeeee hu....uuu,Namoleeeee huuuu,NORMAL,0,0,1,
Nemole ane oata pinsidda wei tattala .putal .bappala .raten pita wela paluan ban kahinetiwa,Nemole ane oata pinsidda wei tattala putal bappala raten pita wela paluan ban kahinetiwa,HATE,1,0,0,
අධිකරණය පවා. දන්නවා රටේ ආර්ථිකය කඩා වැටීමට හේතුව  කලින් ආණ්ඩු බව,අධිකරණය පවා දන්නවා රටේ ආර්ථිකය කඩා වැටීමට හේතුව කලින් ආණ්ඩු බව,NORMAL,0,0,1,
බොරු කතා තාත්තා වඩා හොඳ වේවි පුතා ආවාම,බොරු කතා තාත්තා වඩා හොඳ වේවි පුතා ආවාම,NORMAL,0,0,1,
ISSARA VIDIYATA DUWA PENA YANA EKA MATHAKADA THAHANAM KARÀPU DINE. NE MOLE APE UDARA MINISKAME MINISA  AKD  ITHAMA AMARUWEN GENA YANA SATAN MAGA. PODU JANA JAYAMAGAI. OBA SAHAYOGAYA LEBEEMA E MAGE IKMAN AWASANAYA.,ISSARA VIDIYATA DUWA PENA YANA EKA MATHAKADA THAHANAM KARPU DINE NE MOLE APE UDARA MINISKAME MINISA AKD ITHAMA AMARUWEN GENA YANA SATAN MAGA PODU JANA JAYAMAGAI OBA SAHAYOGAYA LEBEEMA E MAGE IKMAN AWASANAYA,HATE,1,0,0,MOLE
Janapthita higanno kiyana ekata nadu dannath puluwan janapathi  katha karanakota Ahagena inna janathwa kamathii,Janapthita higanno kiyana ekata nadu dannath puluwan janapathi katha karanakota Ahagena inna janathwa kamathii,HATE,1,0,0,
"විදේශීය ආයෝජකයන් වගේම දේශිය කුඩා ආයෝජකයන් නිසාත් ගොඩක් රැකියා අවස්තා ලැබෙනවා.අද එවන් කර්මාන්ත රාශියක් ගංවතුර,සුලිකුණාටු නිසා විනාශවෙලා.එයාලට වන්දි වශයෙන් රු.ලක්ශ දෙකක් ප්‍රමානවත් නෑ .",විදේශීය ආයෝජකයන් වගේම දේශිය කුඩා ආයෝජකයන් නිසාත් ගොඩක් රැකියා අවස්තා ලැබෙනවාඅද එවන් කර්මාන්ත රාශියක් ගංවතුරසුලිකුණාටු නිසා විනාශවෙලාඑයාලට වන්දි වශයෙන් රුලක්ශ දෙකක් ප්රමානවත් නෑ,NORMAL,0,0,1,
Melo rahak naa huuuuuuuuuuuu huuuuuuuuuu,Melo rahak naa huuuuuuuuuuuu huuuuuuuuuu,NORMAL,0,0,1,
නැ මොලයෝ ලැයිස්තුවෙන් නේද ආවේ ඇයි චන්දේ ඉල්ලුවේ නැත්තේ ඉල්ලන්නනෙ තිබ්බේ,නැ මොලයෝ ලැයිස්තුවෙන් නේද ආවේ ඇයි චන්දේ ඉල්ලුවේ නැත්තේ ඉල්ලන්නනෙ තිබ්බේ,NORMAL,0,0,1,
මොලයක් නැති නැ මොලයෝ ඇතිද අහගත්තා,මොලයක් නැති නැ මොලයෝ ඇතිද අහගත්තා,HATE,1,0,0,
නෑමොලයෝ තෝ මොන්ටිසෝරියේ ඉදල ඉගෙන ගෙන වරෙන් අනුර සමග කතාකරන්න,නෑමොලයෝ තෝ මොන්ටිසෝරියේ ඉදල ඉගෙන ගෙන වරෙන් අනුර සමග කතාකරන්න,NORMAL,0,0,1,
Namal monawà kiyanawada mandaa?,Namal monaw kiyanawada mandaa,NORMAL,0,0,1,
ජයවේවා.ජනපතිතුමණි.   ..,ජයවේවාජනපතිතුමණි,NORMAL,0,0,1,
Mahindaga.sunakapatiya.gongahannawidihak.naathuwa.okun.dan.raalawatana.kala.balagana.okun.innathaana.harakta.jangi.andapalla🎉🎉🎉,Mahindagasunakapatiyagongahannawidihaknaathuwaokundanraalawatanakalabalaganaokuninnathaanaharaktajangiandapalla,HATE,1,0,0,
ආයේ ආණ්ඩු හැදෙන්නෑ....😊🖤,ආයේ ආණ්ඩු හැදෙන්නෑ,NORMAL,0,0,1,
ඔය  නාමලය   ට  ෙරද්ෙද ෙරවිල,ඔය නාමලය ට ෙරද්ෙද ෙරවිල,HATE,1,0,0,
ඔයාලගේ කාලයක් එන්නේ නෑ නැවත  👍🤣🤣😭,ඔයාලගේ කාලයක් එන්නේ නෑ නැවත,NORMAL,0,0,1,
"බැරිනම්. නාමල් ලගෙ ආන්ඩූවක් ආවම
  ගෙවන්නමිලු
දවල්? දන්නෑ",බැරිනම් නාමල් ලගෙ ආන්ඩූවක් ආවම ගෙවන්නමිලු දවල් දන්නෑ,NORMAL,0,0,1,
Thoppilqge.mahaaka  rata.karane..jaatthibeda. adala..musleem.janathavata.pahara..allakarala ..thoppi.qnqva..ratta.kqranna..thoppi.okkoma.horu,Thoppilqgemahaaka ratakaranejaatthibeda adalamusleemjanathavatapaharaallakarala thoppiqnqvarattakqrannathoppiokkomahoru,HATE,1,0,0,
රටේත් ධනය හොරා කාලා කහල කාලා තවත් කතා කරන ලැජ්ජ නැතුව,රටේත් ධනය හොරා කාලා කහල කාලා තවත් කතා කරන ලැජ්ජ නැතුව,NORMAL,0,0,1,
තොපේ ආණ්ඩුකාලේ කරපුවා තමයි ඔය,තොපේ ආණ්ඩුකාලේ කරපුවා තමයි ඔය,NORMAL,0,0,1,
ඔයාලට  මතකද දන්නෙ නැහැ  සිංගප්පූරු වේ ජනාධිපති තුමා  ඒ කාලෙ අපේ රටට  ආපු වෙලාවෙ අපේ රටේ ලස්සන දැකල එයා කිව්වෙ සිංගප්පූරුව  ලංකාව  වගේ  හදනව කියල  ඒවගේ  එතුමා  ඒක  කලා ඒත්  අපේ රට  ඒ කාලෙ සිංගප්පූරුව  වගේ කලා හිටපු  නායකත්වය   කියන්න  ලැජ්ජයි නේද   දැන්  බොරුවට  කෑගහනව  හිටපු  අය ඇයි  කෙරුවෙ  නැත්තෙ,ඔයාලට මතකද දන්නෙ නැහැ සිංගප්පූරු වේ ජනාධිපති තුමා ඒ කාලෙ අපේ රටට ආපු වෙලාවෙ අපේ රටේ ලස්සන දැකල එයා කිව්වෙ සිංගප්පූරුව ලංකාව වගේ හදනව කියල ඒවගේ එතුමා ඒක කලා ඒත් අපේ රට ඒ කාලෙ සිංගප්පූරුව වගේ කලා හිටපු නායකත්වය කියන්න ලැජ්ජයි නේද දැන් බොරුවට කෑගහනව හිටපු අය ඇයි කෙරුවෙ නැත්තෙ,NORMAL,0,0,1,
අඩේ මුන් සින්ගප්පුරුව  කරලනේ තිබුනේ තව පොඩ්ඩක් ඉන්නලූ බලු නාමලයෝ තොපි මේරට හපයක් කරලනේ පැනලා ගියේ,අඩේ මුන් සින්ගප්පුරුව කරලනේ තිබුනේ තව පොඩ්ඩක් ඉන්නලූ බලු නාමලයෝ තොපි මේරට හපයක් කරලනේ පැනලා ගියේ,HATE,1,0,0,බලු
"Ane namal pako  danwath paduwe idapan, ponnaya",Ane namal pako danwath paduwe idapan ponnaya,HATE,1,0,0,"pako, ponnaya"
උඹේ අම්මට හුඛණ්ඩ හුඛණ්ඩ උඹේ තාත්තා මොකද කරේ තොපි අවුරුදු කීයක් කරාද ක*** ඇන ගනින්.,උඹේ අම්මට හුඛණ්ඩ හුඛණ්ඩ උඹේ තාත්තා මොකද කරේ තොපි අවුරුදු කීයක් කරාද ක ඇන ගනින්,HATE,1,0,0,"අම්මට, හුඛණ්ඩ, ඇන, ගනින්"
Kari ponnayo edit karala vedio hadala puka denava jvp ekata avajathaka jeppo,Kari ponnayo edit karala vedio hadala puka denava jvp ekata avajathaka jeppo,HATE,1,0,0,"ponnayo, puka, denava, avajathaka, jeppo"
Thopi kapur rata buruwo,Thopi kapur rata buruwo,HATE,1,0,0,buruwo
ඇහුනද අදෝනාව.ඉස්සර උන් කරපු ඒව නිසා දැන් බය වෙල ඒව මෙයාලත් ඒව වෙයි කියල.😂😂😂😂,ඇහුනද අදෝනාවඉස්සර උන් කරපු ඒව නිසා දැන් බය වෙල ඒව මෙයාලත් ඒව වෙයි කියල,NORMAL,0,0,1,
"Pachaya,gobba kota.",Pachayagobba kota,NORMAL,0,0,1,
Doobi tika hodana hedilla..😂,Doobi tika hodana hedilla,HATE,1,0,0,hedilla
Siiya yananakota doler eka 292 ..den 212.. sthawara bawayada e... me aya vipaksh innakota kale akul helapu  eka  kadakappal karapu eka den merila ipadila wage kaiy  gahanawa..,Siiya yananakota doler eka 292 den 212 sthawara bawayada e me aya vipaksh innakota kale akul helapu eka kadakappal karapu eka den merila ipadila wage kaiy gahanawa,DISINFO,0,1,0,
ජ්නඩ්පප් ට්.ට්,ජ්නඩ්පප් ට්ට්,HATE,1,0,0,
අපේ ජනාධිපතිතුමාට ජයවේවා,අපේ ජනාධිපතිතුමාට ජයවේවා,NORMAL,0,0,1,
❤Adarei ❤ janapati. Tumani❤❤❤,Adarei janapati Tumani,HATE,1,0,0,
නාමලෙයා ෙබාරැ   පච කියන්න   එපා. උසාවියත්.  තින්දුව. දිල තියනව  රාජපක්ෂල රට බංෙකාෙලාත් කලා කියල.  ඇති ෙවන් ෙහාරකම් කරල  රට විනාශ කලා.  නාමලෙයා   ජනාධිපති ෙවන්න නම් හිතන්නවත්. එපා.   කවදාවත් ඒක නම් ෙවන්ෙන නැහැ. හිනයක් විතරයි ඒක.,නාමලෙයා ෙබාරැ පච කියන්න එපා උසාවියත් තින්දුව දිල තියනව රාජපක්ෂල රට බංෙකාෙලාත් කලා කියල ඇති ෙවන් ෙහාරකම් කරල රට විනාශ කලා නාමලෙයා ජනාධිපති ෙවන්න නම් හිතන්නවත් එපා කවදාවත් ඒක නම් ෙවන්ෙන නැහැ හිනයක් විතරයි ඒක,DISINFO,0,1,0,
නැමොලේ උඹේ අප්පා මයිනා රටට මොකද කලේ. උඹේ බාප්පයි අප්පයි රට කැවා .ගොන් පගයා උඹ මැරිලද ඉපදුනේ,නැමොලේ උඹේ අප්පා මයිනා රටට මොකද කලේ උඹේ බාප්පයි අප්පයි රට කැවා ගොන් පගයා උඹ මැරිලද ඉපදුනේ,HATE,1,0,0,"ගොන්, පගයා, මැරිලද"
Mumonawada kiyawanna. Da janadipathita .muta uththaradanna onada.,Mumonawada kiyawanna Da janadipathita muta uththaradanna onada,NORMAL,0,0,1,
රට බංකොලොත් වෙනකල් හොරකම් කරලා තව මුගේ කටේ සද්දේ මිනිස්සු ලක්ෂ ගානාක් පාරට ඇවිත් පවුල් පිටින් එලෙව්වා තවම මුංගේ හොාරකමක් හොයා ගන්න බැයිද,රට බංකොලොත් වෙනකල් හොරකම් කරලා තව මුගේ කටේ සද්දේ මිනිස්සු ලක්ෂ ගානාක් පාරට ඇවිත් පවුල් පිටින් එලෙව්වා තවම මුංගේ හොාරකමක් හොයා ගන්න බැයිද,DISINFO,0,1,0,
You even didn't  even contest.,You even didnt even contest,NORMAL,0,0,1,
What a fool.,What a fool,NORMAL,0,0,1,
හනුම    කට    වහාගෙන     හිටපිය.ගොනා.,හනුම කට වහාගෙන හිටපියගොනා,HATE,1,0,0,
තොපි හොරා කෑවෙ නැති නම් රට සිංගප්පූරුව ට වඩා ඉහළින් ඉන්න තිබ්බා ...,තොපි හොරා කෑවෙ නැති නම් රට සිංගප්පූරුව ට වඩා ඉහළින් ඉන්න තිබ්බා,NORMAL,0,0,1,
namal pakaya  pala pla yanna ponnay,namal pakaya pala pla yanna ponnay,HATE,1,0,0,"pakaya, ponnay"
තාත්තලා  බාප්පල මහප්පලා පුතාලා එකතු වෙලා හොරා කාලා දැන් එනවා රට හදන්න පර බල්ලෝ.,තාත්තලා බාප්පල මහප්පලා පුතාලා එකතු වෙලා හොරා කාලා දැන් එනවා රට හදන්න පර බල්ලෝ,HATE,1,0,0,"පර, බල්ලෝ"
Topi.hora.kewanisa.tamaimerata.wetune.ballo,Topihorakewanisatamaimeratawetuneballo,HATE,1,0,0,
Parli men tuw   e kiyanawanam      bo    ruwak    aeliye   kiuwanam    aeththak    aehemDa,Parli men tuw e kiyanawanam bo ruwak aeliye kiuwanam aeththak aehemDa,NORMAL,0,0,1,
Our respect to our Hon. President Anura Kumara Dissanayake for your powerful speech and your excellent handling of the debate. Sri Lankans who truly love Sri Lanka are looking forward to a developed country under your guidance and this government. May the Triple Gem bless you! 🙏,Our respect to our Hon President Anura Kumara Dissanayake for your powerful speech and your excellent handling of the debate Sri Lankans who truly love Sri Lanka are looking forward to a developed country under your guidance and this government May the Triple Gem bless you,NORMAL,0,0,1,
මෝඩ   නාමල්   පවු   රටට   කෙලිය    දැන්බයිල   😊,මෝඩ නාමල් පවු රටට කෙලිය දැන්බයිල,HATE,1,0,0,
Namolpol😮buruwoo😮tota.kauda😮rata.danna😮moda.namal😮buruwa😮,Namolpolburuwoototakaudaratadannamodanamalburuwa,HATE,1,0,0,
