Original Comment,Cleaned Comment,Label,Hate,Disinfo,Normal,Hate Words
"නාමල් ඔය පන්ඩිතකම් කියවන්න උබ මොනාද බන් දන්නේ උබ ආර්තික විද්‍යාව දන්නවද? දන්න හුත්#ක් කරගෙන හිටු කාලකන්නියා තාත්තල බාප්පල මාමල අම්මල එක්ක එකතුවෙලා රට වල පල්ලට ඇදල දාල එනව මෙතන අනුරට ඇගිල්ල දික කරන්න, තොපි හදාපු රට තමා මේ ගොඩ දාන්න දගලන්නේ කවුරුත් ලියල දුන්න ස්කිරිපිට් එකක් කියවල දුවනවා ..පල් හොරා....අපි මැරිල ඉපදුනේ නෑ බූරුවෝ...",නාමල් ඔය පන්ඩිතකම් කියවන්න උබ මොනාද බන් දන්නේ උබ ආර්තික විද්යාව දන්නවද දන්න හුත්් කරගෙන හිටු කාලකන්නියා තාත්තල බාප්පල මාමල අම්මල එක්ක එකතුවෙලා රට වල පල්ලට ඇදල දාල එනව මෙතන අනුරට ඇගිල්ල දික කරන්න තොපි හදාපු රට තමා මේ ගොඩ දාන්න දගලන්නේ කවුරුත් ලියල දුන්න ස්කිරිපිට් එකක් කියවල දුවනවා පල් හොරාඅපි මැරිල ඉපදුනේ නෑ බූරුවෝ,HATE,1,0,0,"කාලකන්නියා, වල, පල්ලට, ඇදල, දාල, දාන්න, ඉපදුනේ, නෑ, බූරුවෝ"
නාමල් ප.      koo...  තොගේ මහඑකාගෙන් එපැ ඕක අහන්න...,නාමල් ප koo තොගේ මහඑකාගෙන් එපැ ඕක අහන්න,HATE,1,0,0,
ඔය කයිවාරු ගහලා තමා තොපි අපේ රට විනාශ කරලා දාලා මුන් ඉන්නකම් රට හදන්න බැහැ,ඔය කයිවාරු ගහලා තමා තොපි අපේ රට විනාශ කරලා දාලා මුන් ඉන්නකම් රට හදන්න බැහැ,NORMAL,0,0,1,
මුන් කැහැ ගහනවා මිනිසුන් එනකොට දුවපු උන් දැන් කයිය ගහනවා,මුන් කැහැ ගහනවා මිනිසුන් එනකොට දුවපු උන් දැන් කයිය ගහනවා,NORMAL,0,0,1,
Naa   molayo     thota   kata        block    unaa   neda   tharu    dakka   neda    hithalaa    kathaaa    karapiya       heena  dakapiya     thopi     haththa   rata     vinaasa    kalaa    salli   vinaasa   kalaa   kata   vahapiya    moda   gon   booru      balla  janapathi   obata   dewi  pihitai  dewiyan   obava  balaa  gannawaamai  dewi  pihitai   rata   hadanna   piluluwan    obata   pamanai    janathaawa  oba   samagai,Naa molayo thota kata block unaa neda tharu dakka neda hithalaa kathaaa karapiya heena dakapiya thopi haththa rata vinaasa kalaa salli vinaasa kalaa kata vahapiya moda gon booru balla janapathi obata dewi pihitai dewiyan obava balaa gannawaamai dewi pihitai rata hadanna piluluwan obata pamanai janathaawa oba samagai,HATE,1,0,0,"Naa, moda, gon, booru, balla"
"හම්බන්තොට ජාත්‍යන්තර සම්මන්ත්‍රණ ශාලාව,මත්තල එයාපෝට් එක හදල ගත්තු රැඩිකල් තීරණ වලින් උඹල කරපු සංවර්ධනය පොඩ්ඩක් කියපම්කො නාමල් මහත්තයො පොඩ්ඩක්.",හම්බන්තොට ජාත්යන්තර සම්මන්ත්රණ ශාලාවමත්තල එයාපෝට් එක හදල ගත්තු රැඩිකල් තීරණ වලින් උඹල කරපු සංවර්ධනය පොඩ්ඩක් කියපම්කො නාමල් මහත්තයො පොඩ්ඩක්,NORMAL,0,0,1,
තාත්තටයී බාප්පටයී කියපන්  මට අනුර ජනපතී පාඩමක් ඉගැන්නූවා කියා😊,තාත්තටයී බාප්පටයී කියපන් මට අනුර ජනපතී පාඩමක් ඉගැන්නූවා කියා,NORMAL,0,0,1,
කැරියො නාමල් බෙබි ගෙදර පල.,කැරියො නාමල් බෙබි ගෙදර පල,HATE,1,0,0,
නෑමොලයා අතට අරන් පුකේ තියාගත්තා,නෑමොලයා අතට අරන් පුකේ තියාගත්තා,HATE,1,0,0,"පුකේ, තියාගත්තා"
සාටක හොරා  පල පල,සාටක හොරා පල පල,HATE,1,0,0,
Ape janadipathi thumata jaya neyathai❤❤❤❤❤,Ape janadipathi thumata jaya neyathai,NORMAL,0,0,1,
තොපි රට කාල දැන් කයි වාරු ගහන ගොන් පක# නෑ මොලේ නිකමට කියනව නෙමේ,තොපි රට කාල දැන් කයි වාරු ගහන ගොන් පක නෑ මොලේ නිකමට කියනව නෙමේ,HATE,1,0,0,"ගොන්, පක, නෑ, මොලේ"
Ewane wipakse enkam kiuwe Dan tharenawada boru kiyla ratawal winasa karnna Hoda nha kiyla danwath thrum gathathnm hari pahugiya anduwakta uadukarnm ada ape rate Hoda thank ko thibuna udgsana ewa mewa ey okom ajvp karapuwa Dan tharum Ganna okoma ekathuwela yannaona kiyla,Ewane wipakse enkam kiuwe Dan tharenawada boru kiyla ratawal winasa karnna Hoda nha kiyla danwath thrum gathathnm hari pahugiya anduwakta uadukarnm ada ape rate Hoda thank ko thibuna udgsana ewa mewa ey okom ajvp karapuwa Dan tharum Ganna okoma ekathuwela yannaona kiyla,DISINFO,0,1,0,
පල  ⁣හිර බාරයට හොර  සාටකේ,පල හිර බාරයට හොර සාටකේ,HATE,1,0,0,
මු හැමදාම බැනුමි අහනවා  නැමලයා,මු හැමදාම බැනුමි අහනවා නැමලයා,HATE,1,0,0,
Kalakanniya pala pala namal,Kalakanniya pala pala namal,HATE,1,0,0,Kalakanniya
ඇයි වෙන අය නැද්ද ආණ්ඩු කරන්න ?,ඇයි වෙන අය නැද්ද ආණ්ඩු කරන්න,NORMAL,0,0,1,
Namal 🐂🐂🐂🐂🐂 maru kieyawanawa,Namal maru kieyawanawa,HATE,1,0,0,
නැ මොලයෝ තෝ ගොන් කතා කරන්න එපා තොපි රට කාලා දැන් එනවා බන කියන්න ඉරිසියා කාරයෝ,නැ මොලයෝ තෝ ගොන් කතා කරන්න එපා තොපි රට කාලා දැන් එනවා බන කියන්න ඉරිසියා කාරයෝ,HATE,1,0,0,
නාමල්.අහගත්තද,නාමල්අහගත්තද,HATE,1,0,0,
දැන් මූන්ට තෙරේඑන්නේ කළ කන්නි අපේ රට කෑවා,දැන් මූන්ට තෙරේඑන්නේ කළ කන්නි අපේ රට කෑවා,HATE,1,0,0,
නාමල් රෙද්දේ ගු ගියාද.....හරියට කතාවක් කරන්න බැරිනම් පල හු**තෝ යන්න.. ..,නාමල් රෙද්දේ ගු ගියාදහරියට කතාවක් කරන්න බැරිනම් පල හුතෝ යන්න,NORMAL,0,0,1,
දැන් ඉතින් කිසිම ආණ්ඩුවකට වැරදි කරන්න බැහැ. මාලි මාව ඉතා හොඳින් කරගන යැයි සිතමි,දැන් ඉතින් කිසිම ආණ්ඩුවකට වැරදි කරන්න බැහැ මාලි මාව ඉතා හොඳින් කරගන යැයි සිතමි,NORMAL,0,0,1,
මෙච්චර දුර දැක්මක් තිබේ නම් නාමල් මහත්මයා ඇයි ඔබ සියයට දෙකට බැස්සේ.,මෙච්චර දුර දැක්මක් තිබේ නම් නාමල් මහත්මයා ඇයි ඔබ සියයට දෙකට බැස්සේ,NORMAL,0,0,1,
පලමුවෙන්ම ජාතික ලැයිස්තුවේන් පාර්ලිමේන්තු එන එක නවත්වන්න .,පලමුවෙන්ම ජාතික ලැයිස්තුවේන් පාර්ලිමේන්තු එන එක නවත්වන්න,NORMAL,0,0,1,
ඔය මෑමලයා කොමිස් ගහගන්න නැතුව මරු කියවනවා ඕකට ගූ ගහලා එලවන්න ඕනෙ මෑ මල යට,ඔය මෑමලයා කොමිස් ගහගන්න නැතුව මරු කියවනවා ඕකට ගූ ගහලා එලවන්න ඕනෙ මෑ මල යට,HATE,1,0,0,"නැතුව, ගූ, ගහලා, එලවන්න"
ජනාධිපති  thumanu mu  mokekkad  atapaswath  nada  koheda,ජනාධිපති thumanu mu mokekkad atapaswath nada koheda,NORMAL,0,0,1,
Topi appa kala  hadanna epai,Topi appa kala hadanna epai,HATE,1,0,0,
Namal to meranna oni,Namal to meranna oni,NORMAL,0,0,1,
නාවල් මහත්තයෝ ජාතික ලැයිස්තුවෙන් ආවෙ නැත්නම් ඔය පුටුවත් නෑ,නාවල් මහත්තයෝ ජාතික ලැයිස්තුවෙන් ආවෙ නැත්නම් ඔය පුටුවත් නෑ,NORMAL,0,0,1,
namal modaya namala modaya 😂😂 oka gona noveda puta 😂😂 akd ape eka bn😊,namal modaya namala modaya oka gona noveda puta akd ape eka bn,HATE,1,0,0,"gona, puta"
Unta ona me Rata Vinaasa karanna. ANIKA oun Me Lakmawa Diunu Wenawata Akamathima kalliyak OYA. KALA waradi WALATA DADUWAM Labadeema KALA Yhthuya..!!!,Unta ona me Rata Vinaasa karanna ANIKA oun Me Lakmawa Diunu Wenawata Akamathima kalliyak OYA KALA waradi WALATA DADUWAM Labadeema KALA Yhthuya,HATE,1,0,0,karanna
නාමල් උබට නෙවෙයි උබලගෙ පරම්පරාවට ආයෙත් මේ රටේ පාලනය එන්නෙ නැහැ නාමල් බල්ලො උබේ අම්මට කියන්නෙ නැහැ මම පරෙස්සම් වෙයම් නාමල් බල්ලො,නාමල් උබට නෙවෙයි උබලගෙ පරම්පරාවට ආයෙත් මේ රටේ පාලනය එන්නෙ නැහැ නාමල් බල්ලො උබේ අම්මට කියන්නෙ නැහැ මම පරෙස්සම් වෙයම් නාමල් බල්ලො,HATE,1,0,0,"නැහැ, බල්ලො, අම්මට, කියන්නෙ"
නොදකින් කාලකන්නියා ....තොට කියන්න හරුප නෑ බොල. මෑ මැල් තොපි මේ රටට ශාපයක් භූමිකාවක් ඇවිත් ඇදගන පල දෙයියනේ,නොදකින් කාලකන්නියා තොට කියන්න හරුප නෑ බොල මෑ මැල් තොපි මේ රටට ශාපයක් භූමිකාවක් ඇවිත් ඇදගන පල දෙයියනේ,HATE,1,0,0,"කාලකන්නියා, නෑ"
මේක මේ ජාතික ලැයිස්තුවෙන් ද මොකෙන්ද ඇවිත් උඩ පනින හැටි අනේ බූරු පුතේ උබලා හරියට රට කරනම් අද ඔහොම වෙනවද බූරු පුතේ උබලා හොරා කාපු සල්ලි දැන් දෙන්න වෙලාව හරි නිකන් තප්පුනන්නේ නැතුව,මේක මේ ජාතික ලැයිස්තුවෙන් ද මොකෙන්ද ඇවිත් උඩ පනින හැටි අනේ බූරු පුතේ උබලා හරියට රට කරනම් අද ඔහොම වෙනවද බූරු පුතේ උබලා හොරා කාපු සල්ලි දැන් දෙන්න වෙලාව හරි නිකන් තප්පුනන්නේ නැතුව,NORMAL,0,0,1,
Muta pissu chiyana Nisa thamae vipaksata watune,Muta pissu chiyana Nisa thamae vipaksata watune,NORMAL,0,0,1,
පට්ට පල් හොරා කෑ ගහනවා,පට්ට පල් හොරා කෑ ගහනවා,HATE,1,0,0,
Ubala horakan karapu salli Tika   dila lankawa goda dapan gon maamalayo,Ubala horakan karapu salli Tika dila lankawa goda dapan gon maamalayo,HATE,1,0,0,gon
Kiyapan pakaya,Kiyapan pakaya,HATE,1,0,0,pakaya
Ane thopi hitiyoth nam ama kalaya yai ane Pala yanna,Ane thopi hitiyoth nam ama kalaya yai ane Pala yanna,HATE,1,0,0,
❤niya may.sao,niya maysao,NORMAL,0,0,1,
ආර්තිකය අස්ථාවර කරන්න ඒ කාලේ කරපුවා. ආන්ඩු අරාජිත කරන්න දරපු ප්‍රයත්න මතක නෑ. දැන් ඔබට එවැනි කඩාකප්පල් ක්‍රියා නෑ. කරගෙන යන්න. අදානිලාට බාධාකලේ කව්ද?,ආර්තිකය අස්ථාවර කරන්න ඒ කාලේ කරපුවා ආන්ඩු අරාජිත කරන්න දරපු ප්රයත්න මතක නෑ දැන් ඔබට එවැනි කඩාකප්පල් ක්රියා නෑ කරගෙන යන්න අදානිලාට බාධාකලේ කව්ද,NORMAL,0,0,1,
Satakeata maru  peanne,Satakeata maru peanne,NORMAL,0,0,1,
Jaya weva jandhipathi tumani niyamai,Jaya weva jandhipathi tumani niyamai,NORMAL,0,0,1,
අනුර..මහත්තයා..ඕකට...ඕකගෙ...සරමේ...හුජ්ජ..යනවදදන්නෙ..නෙ..,අනුරමහත්තයාඕකටඕකගෙසරමේහුජ්ජයනවදදන්නෙනෙ,HATE,1,0,0,
Hora thoo gotta salli deepiya ballo ganikawanta dunna  away ganath deepiya ballo,Hora thoo gotta salli deepiya ballo ganikawanta dunna away ganath deepiya ballo,NORMAL,0,0,1,
ජෙසුපිහීටයි ❤ඔබතුමාට  ඡයෙන් ඡය ලැබෙවා අනුර මහත්තයාට,ජෙසුපිහීටයි ඔබතුමාට ඡයෙන් ඡය ලැබෙවා අනුර මහත්තයාට,NORMAL,0,0,1,
"තාත්තල,පුතාල,බාප්පල,කාපුවමතකනෑ,නාමලෝනාගහටත්අපහසයි,උබලවගේමතමයිඝමේඉන්නහැතිකරේ අපේජනාධිපතිතුමාටජයවේවාස්වහාදහමේආශීර්වාදයලැබේවා",තාත්තලපුතාලබාප්පලකාපුවමතකනෑනාමලෝනාගහටත්අපහසයිඋබලවගේමතමයිඝමේඉන්නහැතිකරේ අපේජනාධිපතිතුමාටජයවේවාස්වහාදහමේආශීර්වාදයලැබේවා,HATE,1,0,0,
Garu janapati thumani api obasamagai budusaranai jaye wewa🙏,Garu janapati thumani api obasamagai budusaranai jaye wewa,HATE,1,0,0,
Balu wadan apita epa😂😂😂 namali,Balu wadan apita epa namali,NORMAL,0,0,1,
තෝ⁣ බලාගෙන ඉන්නේ ආයිත් රට කන්න පුලුවන් කියලද අනේපකෝ තෝපේ දේශපාලනය මෙතනින් ඉවරයි,තෝ බලාගෙන ඉන්නේ ආයිත් රට කන්න පුලුවන් කියලද අනේපකෝ තෝපේ දේශපාලනය මෙතනින් ඉවරයි,NORMAL,0,0,1,
නාමල් රටෙ ජනතාව දන්නවා රටට ආදරෙ කවුද ජනතාවට ආදරෙ කවුද හොරා කන්නා කවුද කුඩු ගෙන්නන්න බලය පෙන්නලා නිතිය මුලා කරෙ කවුද  එක නිසා නාමලො වරද වල් පිලිඅරන් ජම්පරෙ දා ගන්න ලෙස්ති වෙයන් නාමල් ගොතයො,නාමල් රටෙ ජනතාව දන්නවා රටට ආදරෙ කවුද ජනතාවට ආදරෙ කවුද හොරා කන්නා කවුද කුඩු ගෙන්නන්න බලය පෙන්නලා නිතිය මුලා කරෙ කවුද එක නිසා නාමලො වරද වල් පිලිඅරන් ජම්පරෙ දා ගන්න ලෙස්ති වෙයන් නාමල් ගොතයො,DISINFO,0,1,0,
මාලිමාවට   ජය  වේවා!!!❤❤❤🎉🎉🎉,මාලිමාවට ජය වේවා,NORMAL,0,0,1,
ජනපති තුමනි අපි ඔබ සමගයි,ජනපති තුමනි අපි ඔබ සමගයි,NORMAL,0,0,1,
නාමල් ගේ පඩ ෂෝ.... බැරි කල්ලා...,නාමල් ගේ පඩ ෂෝ බැරි කල්ලා,HATE,1,0,0,
හොදට මතක තියගන්න 2029 ජනාධිපති නාමල් රාජපක්ෂ ❤😍,හොදට මතක තියගන්න 2029 ජනාධිපති නාමල් රාජපක්ෂ,NORMAL,0,0,1,
කපන්නෙ ඇයිද දන් නෑ😂,කපන්නෙ ඇයිද දන් නෑ,NORMAL,0,0,1,
😂😂😂😂😂😂😂palayan,palayan,HATE,1,0,0,palayan
අ හරි හරි නාමල් ඔය පවු ඇ උබලගෙ තනිකරම තිබුනෙ හොරාකන සැලැස්මවල්  විතරයි අනික ඔයාලා කලින් අවු14ක් රට කරනෙ ඉතින් ඇයි තවත් ඔයලම රට හදන්ට ඔනි කියන්නෙ උබලා හදපු තරම හොදටම ඇති නාමල්,අ හරි හරි නාමල් ඔය පවු ඇ උබලගෙ තනිකරම තිබුනෙ හොරාකන සැලැස්මවල් විතරයි අනික ඔයාලා කලින් අවු14ක් රට කරනෙ ඉතින් ඇයි තවත් ඔයලම රට හදන්ට ඔනි කියන්නෙ උබලා හදපු තරම හොදටම ඇති නාමල්,NORMAL,0,0,1,
They feel jealousy on you all.,They feel jealousy on you all,NORMAL,0,0,1,
Balaya Teyana Kataya  Oya Malaya TEBUNANAM Akala Matak Karganna,Balaya Teyana Kataya Oya Malaya TEBUNANAM Akala Matak Karganna,HATE,1,0,0,
Apee ජනපති tumaatha pin apee rata goda daanawatha..🙏🙏🙏🙏🙏🙏🙏🙏🙏🙏🙏🙏❤️❤️❤️❤️❤️❤️❤️❤️,Apee ජනපති tumaatha pin apee rata goda daanawatha,NORMAL,0,0,1,
"Namal,,sihina,,janadipathi,, mokadda,,tthiyena,,sudusukama",Namalsihinajanadipathi mokaddatthiyenasudusukama,HATE,1,0,0,
තොපිට යන්න අපායවල් නෑ බල්ලො,තොපිට යන්න අපායවල් නෑ බල්ලො,HATE,1,0,0,"බල්ලො, නෑ"
කටවහපිය පර බල්ල,කටවහපිය පර බල්ල,HATE,1,0,0,"පර, බල්ල"
මොලේ හොදටම කචල් පෙරෙතයො  විපක්ෂය  චික් 😂😂😂😂😂😂😂😂😂,මොලේ හොදටම කචල් පෙරෙතයො විපක්ෂය චික්,NORMAL,0,0,1,
නැමොල තෝද රටට හෙණයකි.,නැමොල තෝද රටට හෙණයකි,NORMAL,0,0,1,
ආදරෙයි අපේ ගරු ජනාධිපති තුමනි ❤❤❤🎉,ආදරෙයි අපේ ගරු ජනාධිපති තුමනි,NORMAL,0,0,1,
Tho thopey appachchi bappala mala okkoma ekathu Vela rata kala Naya gananawak thiyala giya thopita meynAnduwa desata .Abhiyoga karanna kisima wathkamak neha yako,Tho thopey appachchi bappala mala okkoma ekathu Vela rata kala Naya gananawak thiyala giya thopita meynAnduwa desata Abhiyoga karanna kisima wathkamak neha yako,HATE,1,0,0,karanna
Malemawata Jayaweva ❤,Malemawata Jayaweva,HATE,1,0,0,
"ඔහේගේ තාත්තා රැඩිකල් තීන්දු අරගෙන ...
සුනාමි ආධාර, මහා භාණ්ඩාගාරේ මුදල්, කොල්ලා කෑවා. රට පුරා ඉඩම්, මාලිගාවල් අයිති කර ගත්තා. හොරා කාපු සල්ලි පිටරට බැංකුවා deposit කලා. 
ඇදුම් ඇදගෙනද ඔය කතා ??",ඔහේගේ තාත්තා රැඩිකල් තීන්දු අරගෙන සුනාමි ආධාර මහා භාණ්ඩාගාරේ මුදල් කොල්ලා කෑවා රට පුරා ඉඩම් මාලිගාවල් අයිති කර ගත්තා හොරා කාපු සල්ලි පිටරට බැංකුවා deposit කලා ඇදුම් ඇදගෙනද ඔය කතා,DISINFO,0,1,0,
නැමලරටකැවාතවත්බමිබුවක්කියනවා😅,නැමලරටකැවාතවත්බමිබුවක්කියනවා,HATE,1,0,0,
පව්   නාමල්  රාජපක්ෂ  මන්ත්‍රී,පව් නාමල් රාජපක්ෂ මන්ත්රී,NORMAL,0,0,1,
Janapathiethumadavekanakwaga,Janapathiethumadavekanakwaga,NORMAL,0,0,1,
කොහෙද පකෝ මේකෙ තියෙන්නෙ තෝ කියපු කථාව..,කොහෙද පකෝ මේකෙ තියෙන්නෙ තෝ කියපු කථාව,NORMAL,0,0,1,
Muwage ponnayo  pada show danawaw,Muwage ponnayo pada show danawaw,NORMAL,0,0,1,
We love you Mr President 🎉🎉🎉🎉🎉🎉🎉🎉❤❤❤❤❤❤❤❤❤,We love you Mr President,NORMAL,0,0,1,
Rajapaksalagen hora kapu salli ganna  kiyala api anduwata kiyanawa,Rajapaksalagen hora kapu salli ganna kiyala api anduwata kiyanawa,HATE,1,0,0,hora
Ara hon bada thadiya chamaraya tane ellagena boru kiyanawa buruwa,Ara hon bada thadiya chamaraya tane ellagena boru kiyanawa buruwa,NORMAL,0,0,1,
Thopi me rata kewa gon ballo thoge thsththa thoge amma okkoma horu umbe kata paga etanna puluwan yako ne molayo,Thopi me rata kewa gon ballo thoge thsththa thoge amma okkoma horu umbe kata paga etanna puluwan yako ne molayo,HATE,1,0,0,"gon, ballo, horu"
Me gon paka fanna magulak ne gon paka mee haraka,Me gon paka fanna magulak ne gon paka mee haraka,HATE,1,0,0,"haraka, gon"
ආයොජකයෙක් එනකොට රටෙ උත්ගොශන කරපු අය....,ආයොජකයෙක් එනකොට රටෙ උත්ගොශන කරපු අය,NORMAL,0,0,1,
Horakapuwa apahu dunnanam  mitawada ikmanata rata goda daganna thibba,Horakapuwa apahu dunnanam mitawada ikmanata rata goda daganna thibba,HATE,1,0,0,
අනේ මෑමලයා,අනේ මෑමලයා,HATE,1,0,0,
"Podi myno thopi kaapu rata thopi hadaida hora hettha,",Podi myno thopi kaapu rata thopi hadaida hora hettha,HATE,1,0,0,hora
Sataka paramparawama elwanna one,Sataka paramparawama elwanna one,HATE,1,0,0,
උඹලගෙ හපන්කම් තමයි නාමල් අවුරුදු 28 කට යන්නෙ,උඹලගෙ හපන්කම් තමයි නාමල් අවුරුදු 28 කට යන්නෙ,NORMAL,0,0,1,
ගොන් ගස් බල්ලො තෝ මෙච්චර කාලයක් කෝමා වෙලා හිටියද? තොපේ පවුල මේ රට නැති කලා නේද පරයෝ තොට මතක නැද්ද 😡😡😡😡😡,ගොන් ගස් බල්ලො තෝ මෙච්චර කාලයක් කෝමා වෙලා හිටියද තොපේ පවුල මේ රට නැති කලා නේද පරයෝ තොට මතක නැද්ද,NORMAL,0,0,1,
මේ නාමලයා බලන් ඉන්නෙ 2029 ජනාධිපති වෙන්ඩ.හරි ආසාවෙන් ඉන්නෙ අනේ.ඒක සිහිනයක් විතරමයි.,මේ නාමලයා බලන් ඉන්නෙ 2029 ජනාධිපති වෙන්ඩහරි ආසාවෙන් ඉන්නෙ අනේඒක සිහිනයක් විතරමයි,NORMAL,0,0,1,
පොඩි මයිනා.පොඩි හනුමා,පොඩි මයිනාපොඩි හනුමා,HATE,1,0,0,
ගුහින්දලා ගුමල්😂😂😂,ගුහින්දලා ගුමල්,HATE,1,0,0,
